{
  "providerId": "imageProvider.imagemagick",
  "revision": "r3",
  "acquisition": {
    "mechanism": "PREINSTALLED",
    "source": "local install maintained by owner",
    "official": true,
    "version": "7.1.2",
    "hash": "a1b2c3d4e5f60718293a4b5c6d7e8f90a1b2c3d4e5f60718293a4b5c6d7e8f90"
  },
  "provenanceFacts": {
    "publisher": "ImageMagick Studio LLC",
    "trustState": "TRUSTED",
    "trustEvidence": "official distribution channel recorded at r3"
  },
  "licenseFacts": { "license": "ImageMagick License" },
  "supportedPlatforms": [{ "os": "WINDOWS", "arch": "X64" }],
  "lifecycle": { "supportedOperations": ["CONFIGURE", "REPAIR"] },
  "interfaces": [
    { "interfaceId": "imagemagick-cli", "interfaceClass": "I1", "invocation": "magick convert <typed-args>" }
  ]
}
